<!ELEMENT escuela (baile+)>
<!ELEMENT baile (precio,plazas,fecha_inicio,fecha_finalizacion,dias_semana,nombre_profesor,sala)>
<!ATTLIST baile estilo CDATA #REQUIRED>
<!ELEMENT precio (#PCDATA)>
<!ATTLIST precio periocidad CDATA #FIXED "1 mes"><!ATTLIST precio moneda NMTOKEN #FIXED "Euro">
<!ELEMENT plazas (#PCDATA)>
<!ELEMENT fecha_inicio (#PCDATA)>
<!ELEMENT fecha_finalizacion (#PCDATA)>
<!ELEMENT dias_semana (#PCDATA)>
<!ELEMENT nombre_profesor (#PCDATA)>
<!ELEMENT sala (#PCDATA)>